{"canonical_json":{"algorithm":"utf8-sorted-compact-integer-only-v1","maximum_depth":32,"maximum_safe_integer":9007199254740991,"rejects_duplicate_keys":true,"version":"plantcore.portable-canonical-json.v1"},"cli_stream_versions":[4,5,6],"contract_artifacts":{"app_server_v5_schema":{"canonical_sha256":"1b44fe5b71b9ec6bfb87324d06a78828c7f997d79201dc18316edf68f592f7f3","id":"plantcore.iteron.app-server.v5","path":"contracts/plantcore/app-server-v5.schema.json"},"machine_contract_schema":{"canonical_sha256":"d95fccb554ccfe62c0cc356867dbfcf339ef36be71e0c036caee56e4811329e1","id":"plantcore.iteron.machine-contract.v1","path":"contracts/plantcore/machine-contract.schema.json"},"output_v7_target_schema":{"canonical_sha256":"83ef558efc9c72b375d9f981a73285831b1936ae1e547cef0a67d9ce1d6c30bc","id":"plantcore.iteron-output.v7.target","path":"contracts/plantcore/iteron-output-v7.schema.json"},"workspace_hook_v1_schema":{"canonical_sha256":"cafa69671553ad03fed86b1329342693d985e895bc6253c6bc3cce38a93110fa","id":"plantcore.iteron.workspace-hook.v1","path":"contracts/plantcore/workspace-hook-v1.schema.json"}},"contract_version":"plantcore.iteron.machine-contract.v1","default_cli_stream_version":6,"limits":{"logical_v7_event_max_bytes":65536,"machine_contract_max_bytes":1048576},"plantcore_capabilities":{"budget_limits":["max_turns","max_tokens","max_usd","max_wall_secs"],"consecutive_tool_error_threshold":5,"controls":{"command_idempotency":"plantcore_command_v1","commands":["steer","interrupt","drain","pause_dispatch_after_safe_point","resume_dispatch"],"resume_same_process":true},"external_mcp_postures":["disabled","run_gateway"],"external_mcp_transport":"streamable_http","immutable_agent_instructions":true,"input":["text","image","file"],"input_operations":["user_input","user_input_v2","user_input_v3"],"product_result_statuses":["completed","needs_input"],"product_tools":["request_user_input","publish_artifact"],"resident_bootstrap":"plantcore.iteron-run-bootstrap.v1","resident_server":{"command":"serve","listen":"127.0.0.1:0","transport":"loopback_tcp_jsonl"},"supported_operating_systems":["linux"],"typed_product_result":true,"typed_usage_per_dispatched_logical_turn":true,"usage":{"calculator_contract_version":"plantcore.metering.five-class-ceil.v1","counters":["input_tokens","output_tokens","cache_creation_tokens","cache_read_tokens","thinking_tokens"],"statuses":["complete","unavailable"],"unit":"USD_MICRO"},"usage_unavailable":true,"workspace":{"hook_timeout_milliseconds":2000,"postures":["read_only","read_write"],"pre_tool_use_hook_contract":"plantcore.iteron.workspace-hook.v1","protection_scope":"model_visible_tool_paths_only"}},"release_id":"iteron-v0.0.20","resident_protocol_version":5,"schema_version":4,"type":"machine_contract"}
