{
  "schema_version": 4,
  "type": "machine_contract",
  "contract_version": "plantcore.iteron.machine-contract.v1",
  "release_id": "iteron-v0.0.21",
  "cli_stream_versions": [4, 5, 6],
  "default_cli_stream_version": 6,
  "resident_protocol_version": 5,
  "canonical_json": {
    "version": "plantcore.portable-canonical-json.v1",
    "algorithm": "utf8-sorted-compact-integer-only-v1",
    "maximum_depth": 32,
    "maximum_safe_integer": 9007199254740991,
    "rejects_duplicate_keys": true
  },
  "plantcore_capabilities": {
    "supported_operating_systems": ["linux"],
    "resident_bootstrap": "plantcore.iteron-run-bootstrap.v1",
    "resident_server": {
      "command": "serve",
      "transport": "loopback_tcp_jsonl",
      "listen": "127.0.0.1:0"
    },
    "input": ["text", "image", "file"],
    "input_operations": ["user_input", "user_input_v2", "user_input_v3"],
    "immutable_agent_instructions": true,
    "controls": {
      "resume_same_process": true,
      "command_idempotency": "plantcore_command_v1",
      "commands": ["steer", "interrupt", "drain", "pause_dispatch_after_safe_point", "resume_dispatch"]
    },
    "external_mcp_postures": ["disabled", "run_gateway"],
    "external_mcp_transport": "streamable_http",
    "budget_limits": ["max_turns", "max_tokens", "max_usd", "max_wall_secs"],
    "usage": {
      "statuses": ["complete", "unavailable"],
      "calculator_contract_version": "plantcore.metering.five-class-ceil.v1",
      "unit": "USD_MICRO",
      "counters": ["input_tokens", "output_tokens", "cache_creation_tokens", "cache_read_tokens", "thinking_tokens"]
    },
    "typed_usage_per_dispatched_logical_turn": true,
    "usage_unavailable": true,
    "typed_product_result": true,
    "product_result_statuses": ["completed", "needs_input"],
    "product_tools": ["request_user_input", "publish_artifact"],
    "workspace": {
      "postures": ["read_only", "read_write"],
      "pre_tool_use_hook_contract": "plantcore.iteron.workspace-hook.v1",
      "hook_timeout_milliseconds": 2000,
      "protection_scope": "model_visible_tool_paths_only"
    },
    "consecutive_tool_error_threshold": 5
  },
  "limits": {
    "machine_contract_max_bytes": 1048576,
    "logical_v7_event_max_bytes": 65536
  },
  "contract_artifacts": {
    "machine_contract_schema": {
      "id": "plantcore.iteron.machine-contract.v1",
      "path": "contracts/plantcore/machine-contract.schema.json",
      "canonical_sha256": "d95fccb554ccfe62c0cc356867dbfcf339ef36be71e0c036caee56e4811329e1"
    },
    "app_server_v5_schema": {
      "id": "plantcore.iteron.app-server.v5",
      "path": "contracts/plantcore/app-server-v5.schema.json",
      "canonical_sha256": "1b44fe5b71b9ec6bfb87324d06a78828c7f997d79201dc18316edf68f592f7f3"
    },
    "output_v7_target_schema": {
      "id": "plantcore.iteron-output.v7.target",
      "path": "contracts/plantcore/iteron-output-v7.schema.json",
      "canonical_sha256": "83ef558efc9c72b375d9f981a73285831b1936ae1e547cef0a67d9ce1d6c30bc"
    },
    "workspace_hook_v1_schema": {
      "id": "plantcore.iteron.workspace-hook.v1",
      "path": "contracts/plantcore/workspace-hook-v1.schema.json",
      "canonical_sha256": "cafa69671553ad03fed86b1329342693d985e895bc6253c6bc3cce38a93110fa"
    }
  }
}
